{
  "id": "display-copy",
  "revision": 1,
  "rules_by_locale": {
    "zh-Hant-TW": [
      "CONTENT-001",
      "CONTENT-002",
      "CONTENT-003",
      "CONTENT-004",
      "CONTENT-005",
      "DESIGN-001",
      "DESIGN-002",
      "DESIGN-003",
      "DESIGN-004",
      "DESIGN-005",
      "DESIGN-006",
      "EVIDENCE-001",
      "EVIDENCE-002",
      "EVIDENCE-003",
      "EVIDENCE-004",
      "EVIDENCE-005",
      "ZH-HANT-001",
      "ZH-HANT-002",
      "ZH-HANT-003",
      "ZH-HANT-005",
      "ZH-HANT-006",
      "ZH-HANT-007",
      "ZH-HANT-008",
      "ZH-HANT-009",
      "ZH-HANT-011",
      "ZH-HANT-012",
      "ZH-HANT-013",
      "ZH-HANT-014",
      "ZH-HANT-015"
    ],
    "zh-Hant-HK": [
      "CONTENT-001",
      "CONTENT-002",
      "CONTENT-003",
      "CONTENT-004",
      "CONTENT-005",
      "DESIGN-001",
      "DESIGN-002",
      "DESIGN-003",
      "DESIGN-004",
      "DESIGN-005",
      "DESIGN-006",
      "EVIDENCE-001",
      "EVIDENCE-002",
      "EVIDENCE-003",
      "EVIDENCE-004",
      "EVIDENCE-005",
      "ZH-HANT-001",
      "ZH-HANT-002",
      "ZH-HANT-004",
      "ZH-HANT-005",
      "ZH-HANT-006",
      "ZH-HANT-007",
      "ZH-HANT-008",
      "ZH-HANT-009",
      "ZH-HANT-011",
      "ZH-HANT-012",
      "ZH-HANT-013",
      "ZH-HANT-014",
      "ZH-HANT-015"
    ]
  },
  "guidance": "Select explicit locale before reading records. Rule selection is not a detector pass."
}
